<?xml version="1.0" encoding="UTF-8"?>
<!DOCTYPE recipe PUBLIC "-//Happy-Monkey//DTD RecipeBook//EN"
"./recipeprinter.dtd">

<!-- Sample recipe in recipebook xml format. be sure to use the right dtd 
	file located at ./recipeprinter.dtd And do not place any xml comments om 
	front of the xml tag! -->

<recipe>
	<title>Vegetable Lasagne</title>

	<recipeinfo>
		<tag>carbs</tag>
		<tag>vegetables</tag>

		<author>Cleidig</author>

		<yield>4 servings</yield>

		<preptime>45 minutes</preptime>
	</recipeinfo>

	<ingredientlist>
		<ingredient>
			<quantity>200</quantity>
			gr. mixed vegetables 
		</ingredient>

		<ingredient>
			<quantity>4</quantity>
			tbs. butter 
		</ingredient>

		<ingredient>
			<quantity>150</quantity>
			ml. milk 
		</ingredient>

		<ingredient>
			<quantity>6</quantity>
			lasagne sheets
		</ingredient>

		<ingredient>
			<quantity>1</quantity>
			tbs. flour
		</ingredient>

		<ingredient>
			<quantity>100</quantity>
			gr. gouda cheese 
		</ingredient>

		<ingredient>
			<quantity>1</quantity>
			tbs. mixed spices
		</ingredient>

		<ingredient>
			<quantity>1</quantity>
			bunch of parsley
		</ingredient>
	</ingredientlist>

	<preparation>
		Butter in einem Topf schmelzen lassen, Mehl einrühren bis es dickflüssig wird, dann die Milch mit einem Schneebesen einrühren. Mit Vegeta, Salz, Pfeffer würzen.
		Das Gemüse schön klein schneiden und in der Soße bissfest ziehen lassen. Zum Schluss Petersilie zugeben.
		Zuerst etwas Soße in eine Auflaufform geben damit der Boden bedeckt ist. Dann abwechselnd Lasagneplatten und Gemüsemischung stapeln. Zum Schluss reichlich mit Käse bedecken und im Backofen bei 200 Grad goldgelb überbacken.
	</preparation>
</recipe>