<?xml version="1.0" encoding="UTF-8"?>
<!DOCTYPE recipe PUBLIC "-//Happy-Monkey//DTD RecipeBook//EN"
"./recipeprinter.dtd">
<recipe>
  <title>30-Minute Chili</title>

  <recipeinfo>
    <blurb>An easy to make, mild chili recipe.</blurb>

    <genre>Soup</genre>

    <author>David Horton</author>

    <preptime>30 minutes</preptime>

    <yield>1 servings</yield>
  </recipeinfo>

  <ingredientlist>
    <ingredient>
      <quantity>1</quantity>
      tsp. olive oil
    </ingredient>

    <ingredient>
      <quantity>1</quantity>
       medium onion, chopped 
     </ingredient>

    <ingredient>
      <quantity>1</quantity>
      cloves garlic, minced 
    </ingredient>

    <ingredient>
      <quantity>100</quantity>
      gr. beef stew meat cut into bite-sized pieces 
    </ingredient>

    <ingredient>
      <quantity>1</quantity>
      tsp. chili powder 
    </ingredient>

    <ingredient>
      <quantity>1</quantity>
      tsp. cumin 
    </ingredient>

    <ingredient>
      <quantity>1</quantity>
      tsp. cayenne pepper 
    </ingredient>

    <ingredient>
      <quantity>8</quantity>
      oz. crushed tomatoes 
    </ingredient>

    <ingredient>
      <quantity>5</quantity>
      oz. Brooks chili hot beans, drained 
    </ingredient>

    <ingredient>
      <quantity>1</quantity>
      tsp. kosher salt 
    </ingredient>

    <ingredient>
      <quantity>1</quantity>
      tsp. brown sugar 
    </ingredient>
  </ingredientlist>

  <preparation>
    Add olive oil, garlic and onion to a 4-quart saucepan. 
    Sweat onion and garlic for a few minutes over medium-low heat. 
    Add beef, chili powder, cumin and cayenne pepper. 
    Raise heat to brown the meat slightly. 
    Add crushed tomatoes, beans, salt and sugar. 
    Reduce heat to a low simmer. 
    Cook for at least 20 minutes before serving, much longer if time permits.
  </preparation>
  <serving>Top with Chihuahua cheese and sour cream. Serve with
  cornbread.</serving>

  <notes>Lean ground beef may be used in place of stew meat.</notes>
</recipe>