<?xml version="1.0" encoding="UTF-8"?>
<!DOCTYPE recipe PUBLIC "-//Happy-Monkey//DTD RecipeBook//EN" "./recipeprinter.dtd">
<recipe>
	<title>Vegetable Stir Fry with Chicken</title>

	<recipeinfo>
	    <!-- some example tags to use -->
	    <tag>vegetables</tag>
	    <tag>meat</tag>
	    
	    <author>Picassos</author>

		<preptime>About one hour</preptime>
		
		<!-- time in milliseconds is just for processing reasons, so out printer can decide how long the preparation takes -->
		<preptimeutc>1800000</preptimeutc>
	</recipeinfo>

	<ingredientlist>
		<ingredient>
			<quantity>100</quantity>
			gr. chicken breast 
		</ingredient>
		<ingredient>
			<quantity>1</quantity>
			tbs. olive oil 
		</ingredient>

		<ingredient>
			<quantity>100</quantity>
			ml. vegetable stock 
		</ingredient>

		<ingredient>
			<quantity>1</quantity>
			medium sized onion 
		</ingredient>

		<ingredient>
			<quantity>1</quantity>
			garlic cloves
		</ingredient>

		<ingredient>
			<quantity>1</quantity>
			paprica
		</ingredient>

		<ingredient>
			<quantity>75</quantity>
			gr. zucchini 
		</ingredient>

		<ingredient>
			<quantity>500</quantity>
			gr. carrots 
		</ingredient>

		<ingredient>
			<quantity>50</quantity>
			gr. champignions 
		</ingredient>

		<ingredient>
			<quantity>50</quantity>
			gr. sour cream 
		</ingredient>

		<ingredient>
			<quantity>1</quantity>
			tbs. creme fraiche 
		</ingredient>

		<ingredient>
			<quantity>1</quantity>
			glass red wine 
		</ingredient>
		
		<ingredient>
			<quantity>1</quantity>
			pinch of basil
		</ingredient>
		
		<ingredient>
			<quantity>1</quantity>
			pinch of thyme
		</ingredient>
		
		<ingredient>
			<quantity>1</quantity>
			tbs. italian spices
		</ingredient>
	</ingredientlist>

	<preparation>
		In a 3-quart saucepan sweat garlic and celery in olive oil over medium-low heat. Add ground beef and raise heat to brown slightly. Drain fat if necessary. Add crushed tomatoes, spices, sugar and salt. 
		Lower heat to a slow simmer and add cheese. Cook for at least 30 minutes, much longer if possible. 
	</preparation>

	<serving>Serve over spaghetti or any other favorite pasta.</serving>

	<notes>Make a double batch and freeze the leftover sauce for a quick
		meal
		later on.</notes>
</recipe>