<?xml version="1.0" encoding="UTF-8"?>
<!DOCTYPE recipe PUBLIC "-//Happy-Monkey//DTD RecipeBook//EN" "./recipeprinter.dtd">
<recipe>
	<title>Pasta Sauce With Meat</title>

	<recipeinfo>
	    <tag>meat</tag>
	    <tag>carbs</tag>
	    
	    <author>I'm the author</author>
		<blurb>A good all-around meat sauce to use with a variety of pasta
			dishes.</blurb>

		<genre>Comfort food</genre>

		<author>David Horton</author>

		<yield>Makes enough for 2 lbs. of pasta.</yield>

		<preptime>About one hour</preptime>
		
		<preptimeutc>60</preptimeutc>
	</recipeinfo>

	<ingredientlist>
		<ingredient>
			<quantity>1</quantity>
			tsp. olive oil 
		</ingredient>
		<ingredient>
			<quantity>1</quantity>
			cloves garlic, minced 
		</ingredient>
		<ingredient>
			<quantity>1</quantity>
			rib celery, finely chopped 
		</ingredient>
		<ingredient>
			<quantity>200</quantity>
			gr. lean ground beef 
		</ingredient>
		<ingredient>
			<quantity>14</quantity>
			oz. crushed tomatoes 
		</ingredient>
		<ingredient>
			<quantity>2</quantity>
			oz. tomato paste 
		</ingredient>
		<ingredient>
			<quantity>1</quantity>
			tsp. Italian seasoning 
		</ingredient>
		<ingredient>
			<quantity>1</quantity>
			tsp. sweet basil 
		</ingredient>
		<ingredient>
			<quantity>1</quantity>
			tsp. brown sugar 
		</ingredient>
		<ingredient>
			<quantity>1</quantity>
			tsp. kosher salt 
		</ingredient>
		<ingredient>
			<quantity>1</quantity>
			pinch of crushed red pepper </ingredient>
		<ingredient>
			<quantity>50</quantity>
			gr. grated Romano cheese 
		</ingredient>
	</ingredientlist>

	<preparation>
		In a 3-quart saucepan sweat garlic and celery in olive oil over medium-low heat. 
		Add ground beef and raise heat to brown slightly. Drain fat if necessary. 
		Add crushed tomatoes, spices, sugar and salt. Lower heat to a slow simmer and add cheese. 
		Cook for at least 30 minutes, much longer if possible. 
	</preparation>

	<serving>Serve over spaghetti or any other favorite pasta.</serving>

	<notes>Make a double batch and freeze the leftover sauce for a quick
		meal
		later on.</notes>
</recipe>